title,author,avg_rating,rating_count,year_published,genre
Principles of Microeconomics (Paperback),N. Gregory Mankiw,3.84,"1,182",1997,textbooks
Introduction to Elementary Particles (Hardcover),David J. Griffiths,4.26,651,1987,textbooks
The Pragmatic Programmer: From Journeyman to Master (Paperback),Andy   Hunt,4.33,"23,796",1999,textbooks
Introduction to Linear Algebra (Hardcover),Gilbert Strang,4.24,695,1993,textbooks
Romeo and Juliet (Mass Market Paperback),William Shakespeare,3.74,"2,795,233",1590,textbooks
Mathematical Methods for Physics and Engineering (Paperback),K.F. Riley,4.16,243,1998,textbooks
,,,,,textbooks
,,,,,textbooks
"Braiding Sweetgrass: Indigenous Wisdom, Scientific Knowledge, and the Teachings of Plants (Hardcover)",Robin Wall Kimmerer,4.51,"166,339",2013,indigenous
There There (Hardcover),Tommy Orange,3.97,"219,811",2018,indigenous
"Firekeeper’s Daughter (Firekeeper's Daughter, #1)",Angeline Boulley,4.31,"194,223",2021,indigenous
The Marrow Thieves (Paperback),Cherie Dimaline,3.94,"43,090",2017,indigenous
"Moon of the Crusted Snow (Moon, #1)",Waubgeshig Rice,3.83,"41,354",2018,indigenous
Five Little Indians (ebook),Michelle Good,4.46,"45,504",2020,indigenous
The Only Good Indians (Hardcover),Stephen Graham Jones,3.68,"109,858",2020,indigenous
Indian Horse (Paperback),Richard Wagamese,4.41,"33,820",2012,indigenous
The Inconvenient Indian: A Curious Account of Native People in North America (Kindle Edition),Thomas King,4.24,"17,598",2012,indigenous
The Absolutely True Diary of a Part-Time Indian (Hardcover),Sherman Alexie,4.06,"283,361",2007,indigenous
"Seven Fallen Feathers: Racism, Death, and Hard Truths in a Northern City (Paperback)",Tanya Talaga,4.52,"14,286",2017,indigenous
The Berry Pickers (Hardcover),Amanda    Peters,4.08,"279,219",2023,indigenous
Jonny Appleseed (Paperback),Joshua Whitehead,3.94,"16,549",2018,indigenous
"An Indigenous Peoples' History of the United States (ReVisioning American History, #3)",Roxanne Dunbar-Ortiz,4.37,"19,996",2014,indigenous
Never Whistle at Night: An Indigenous Dark Fiction Anthology (Paperback),Shane Hawk,,,,indigenous
A Mind Spread Out on the Ground (Hardcover),Alicia Elliott,4.40,"10,416",2019,indigenous
Bad Cree (Hardcover),Jessica Johns,3.90,"18,877",2023,indigenous
Split Tooth (Kindle Edition),Tanya Tagaq,3.89,"13,287",2018,indigenous
Heart Berries (Hardcover),Terese Marie Mailhot,3.82,"29,691",2018,indigenous
"Elatsoe (Elatsoe, #1)",Darcie Little Badger,3.98,"22,756",2020,indigenous
"From the Ashes: My Story of Being Métis, Homeless, and Finding My Way (Paperback)",Jesse Thistle,4.49,"34,005",2019,indigenous
The Break (Paperback),Katherena Vermette,4.27,"21,997",2016,indigenous
Bury My Heart at Wounded Knee: An Indian History of the American West (Paperback),Dee Brown,4.26,"101,068",1970,indigenous
The Round House (Hardcover),Louise Erdrich,3.98,"123,549",2012,indigenous
"Son of a Trickster (Trickster, #1)",Eden Robinson,3.81,"14,048",2017,indigenous
Killers of the Flower Moon: The Osage Murders and the Birth of the FBI (Paperback),David Grann,4.14,"436,721",2017,indigenous
21 Things You May Not Know About the Indian Act (Paperback),Bob Joseph,4.57,"9,773",2018,indigenous
The Night Watchman (ebook),Louise Erdrich,4.09,"91,548",2020,indigenous
The Sentence (Hardcover),Louise Erdrich,3.93,"81,559",2021,indigenous
The Serviceberry: Abundance and Reciprocity in the Natural World (Hardcover),Robin Wall Kimmerer,4.32,"43,744",2024,indigenous
Empire of Wild (Hardcover),Cherie Dimaline,3.74,"12,525",2019,indigenous
Monkey Beach (Paperback),Eden Robinson,4.02,"10,452",2000,indigenous
This Place: 150 Years Retold (Paperback),Kateri Akiwenzie-Damm,4.35,"4,149",2019,indigenous
"Warrior Girl Unearthed (Firekeeper's Daughter, #2)",Angeline Boulley,4.31,"27,576",2023,indigenous
"Black Sun (Between Earth and Sky, #1)",Rebecca Roanhorse,4.17,"53,071",2020,indigenous
We Are Water Protectors (Hardcover),Carole Lindstrom,4.49,"8,753",2020,indigenous
Wandering Stars (Hardcover),Tommy Orange,3.83,"34,947",2024,indigenous
"My Heart Is a Chainsaw (The Indian Lake Trilogy, #1)",Stephen Graham Jones,3.51,"51,218",2021,indigenous
Medicine Walk (Hardcover),Richard Wagamese,4.30,"13,025",2014,indigenous
"Trail of Lightning (The Sixth World, #1)",Rebecca Roanhorse,3.95,"27,290",2018,indigenous
The Seed Keeper (Paperback),Diane         Wilson,4.27,"22,620",2021,indigenous
Ceremony (Paperback),Leslie Marmon Silko,3.84,"26,163",1977,indigenous
Winter Counts (Hardcover),David Heska Wanbli Weiden,3.84,"22,927",2020,indigenous
Birdie (Hardcover),Tracey Lindberg,3.67,"5,573",2015,indigenous
Night of the Living Rez (Paperback),Morgan Talty,3.88,"12,782",2022,indigenous
"As Long as Grass Grows: The Indigenous Fight for Environmental Justice, from Colonization to Standing Rock (Hardcover)",Dina Gilio-Whitaker,4.36,"2,263",2019,indigenous
Islands of Decolonial Love: Stories & Songs (Paperback),Leanne Betasamosake Simpson,4.34,"3,119",2013,indigenous
A History of My Brief Body (Kindle Edition),Billy-Ray Belcourt,4.18,"5,516",2020,indigenous
"Moon of the Turning Leaves (Moon, #2)",Waubgeshig Rice,4.23,"10,049",2023,indigenous
The Heartbeat of Wounded Knee: Native America from 1890 to the Present (ebook),David Treuer,4.23,"6,551",2019,indigenous
,,,,,indigenous
,,,,,indigenous
"Heartstopper: Volume One (Heartstopper, #1)",Alice Oseman,4.42,"869,504",2018,graphic-novels-manga
"Heartstopper: Volume Two (Heartstopper, #2)",Alice Oseman,4.51,"562,844",2019,graphic-novels-manga
"Saga, Volume 1 (Paperback)",Brian K. Vaughan,,,,graphic-novels-manga
"Heartstopper: Volume Three (Heartstopper, #3)",Alice Oseman,4.54,"493,224",2020,graphic-novels-manga
Nimona (ebook),N.D. Stevenson,4.18,"184,718",2015,graphic-novels-manga
"Heartstopper: Volume Four (Heartstopper, #4)",Alice Oseman,4.58,"436,771",2021,graphic-novels-manga
The Prince and the Dressmaker (Paperback),Jen Wang,4.33,"121,079",2018,graphic-novels-manga
"The Tea Dragon Society (Tea Dragon, #1)",Kay O'Neill,4.34,"68,835",2017,graphic-novels-manga
"Saga, Volume 2 (Paperback)",Brian K. Vaughan,,,,graphic-novels-manga
"Paper Girls, Volume 1 (Paperback)",Brian K. Vaughan,,,,graphic-novels-manga
"Saga, Volume 3 (Paperback)",Brian K. Vaughan,,,,graphic-novels-manga
Pumpkinheads (Hardcover),Rainbow Rowell,4.01,"90,199",2019,graphic-novels-manga
"Lore Olympus: Volume One (Lore Olympus, #1)",Rachel  Smythe,4.21,"170,969",2021,graphic-novels-manga
Mooncakes (Paperback),Suzanne  Walker,3.81,"47,183",2019,graphic-novels-manga
"Spy x Family, Vol. 1 (Kindle Edition)",Tatsuya Endo,4.44,"178,702",2019,graphic-novels-manga
"Saga, Volume 4 (Paperback)",Brian K. Vaughan,,,,graphic-novels-manga
Through the Woods (Hardcover),E.M. Carroll,3.94,"87,303",2014,graphic-novels-manga
Uzumaki (Hardcover),Junji Ito,4.45,"85,572",2000,graphic-novels-manga
Watchmen (Paperback),Alan             Moore,4.39,"591,383",1987,graphic-novels-manga
"Heartstopper: Volume Five (Heartstopper, #5)",Alice Oseman,4.46,"191,937",2023,graphic-novels-manga
"Saga, Volume 5 (Paperback)",Brian K. Vaughan,,,,graphic-novels-manga
Anya's Ghost (Hardcover),Vera Brosgol,3.90,"93,243",2011,graphic-novels-manga
Fangs (Kindle Edition),Sarah Andersen,4.21,"52,935",2020,graphic-novels-manga
Bloom (Paperback),Kevin Panetta,3.90,"62,497",2019,graphic-novels-manga
This One Summer (Hardcover),Mariko Tamaki,3.69,"91,826",2014,graphic-novels-manga
"Persepolis: The Story of a Childhood (Persepolis, #1)",Marjane Satrapi,4.27,"227,879",2003,graphic-novels-manga
"Lumberjanes, Vol. 1: Beware the Kitten Holy (Paperback)",N.D. Stevenson,,,,graphic-novels-manga
The Girl from the Sea (Hardcover),Molly Knox Ostertag,4.12,"60,837",2021,graphic-novels-manga
Laura Dean Keeps Breaking Up with Me (Hardcover),Mariko Tamaki,3.84,"68,810",2019,graphic-novels-manga
"Death Note, Vol. 1: Boredom (Death Note, #1)",Tsugumi Ohba,4.47,"353,805",2004,graphic-novels-manga
"The Sandman, Vol. 1: Preludes & Nocturnes (Hardcover)",Neil Gaiman,4.25,"272,862",1988,graphic-novels-manga
The Complete Maus (Paperback),Art Spiegelman,4.58,"250,139",1980,graphic-novels-manga
"The Tea Dragon Festival (Tea Dragon, #2)",Kay O'Neill,4.39,"32,055",2019,graphic-novels-manga
Welcome to Lovecraft (Locke & Key #1),Joe Hill,4.15,"99,485",2008,graphic-novels-manga
"Maus I: A Survivor's Tale: My Father Bleeds History (Maus, #1)",Art Spiegelman,4.39,"370,638",1986,graphic-novels-manga
"Sheets (Sheets, #1)",Brenna Thummler,3.84,"49,650",2018,graphic-novels-manga
Fun Home: A Family Tragicomic (Paperback),Alison Bechdel,4.07,"199,947",2006,graphic-novels-manga
"Saga, Volume 6 (Paperback)",Brian K. Vaughan,,,,graphic-novels-manga
"Orange: The Complete Collection, Volume 1 (Paperback)",Ichigo Takano,4.43,"29,565",2016,graphic-novels-manga
Blankets (Paperback),Craig Thompson,4.06,"124,579",2003,graphic-novels-manga
"Fence, Vol. 1 (Paperback)",C.S. Pacat,3.92,"29,730",2017,graphic-novels-manga
The Complete Persepolis (Paperback),Marjane Satrapi,4.40,"202,791",2007,graphic-novels-manga
SPY×FAMILY 2 (Paperback),Tatsuya Endo,4.53,"54,627",2019,graphic-novels-manga
On a Sunbeam (Paperback),Tillie Walden,4.30,"33,976",2018,graphic-novels-manga
"Tokyo Ghoul, Tome 1 (Tokyo Ghoul, #1)",Sui Ishida,4.40,"163,830",2012,graphic-novels-manga
"Saga, Volume 7 (Paperback)",Brian K. Vaughan,,,,graphic-novels-manga
"The Wicked + The Divine, Vol. 1: The Faust Act (Paperback)",Kieron Gillen,,,,graphic-novels-manga
V for Vendetta (Hardcover),Alan             Moore,4.26,"323,051",1990,graphic-novels-manga
American Born Chinese (Paperback),Gene Luen Yang,3.88,"100,926",2006,graphic-novels-manga
"Siúil, a Rún: The Girl From the Other Side, Vol. 1 (The Girl from the Other Side, #1)",Nagabe,4.23,"30,109",2016,graphic-novels-manga
"The Hunger Games (The Hunger Games, #1)",Suzanne Collins,4.35,"9,746,939",2008,futuristic
"Catching Fire (The Hunger Games, #2)",Suzanne Collins,4.35,"4,086,139",2009,futuristic
"Mockingjay (The Hunger Games, #3)",Suzanne Collins,4.12,"3,659,660",2010,futuristic
"Cinder (The Lunar Chronicles, #1)",Marissa Meyer,4.12,"1,003,083",2012,futuristic
"Divergent (Divergent, #1)",Veronica Roth,4.13,"4,333,481",2011,futuristic
"Naked in Death (In Death, #1)",J.D. Robb,4.13,"203,102",1995,futuristic
"Scarlet (The Lunar Chronicles, #2)",Marissa Meyer,4.23,"457,035",2013,futuristic
"Ready Player One (Ready Player One, #1)",Ernest Cline,4.23,"1,283,782",2011,futuristic
"Insurgent (Divergent, #2)",Veronica Roth,3.96,"1,610,433",2012,futuristic
"The Giver (The Giver, #1)",Lois Lowry,4.12,"2,769,544",1993,futuristic
"Glory in Death (In Death, #2)",J.D. Robb,4.27,"71,754",1995,futuristic
"Cress (The Lunar Chronicles, #3)",Marissa Meyer,4.40,"400,959",2014,futuristic
"Immortal in Death (In Death, #3)",J.D. Robb,4.28,"61,127",1996,futuristic
1984 (Paperback),George Orwell,4.20,"5,346,448",1949,futuristic
"Allegiant (Divergent, #3)",Veronica Roth,3.60,"1,132,713",2013,futuristic
"Matched (Matched, #1)",Ally Condie,3.62,"812,508",2010,futuristic
"Rapture in Death (In Death, #4)",J.D. Robb,4.28,"53,993",1996,futuristic
"The Maze Runner (The Maze Runner, #1)",James Dashner,4.05,"1,659,144",2009,futuristic
"Ender’s Game (Ender's Saga, #1)",Orson Scott Card,4.31,"1,462,677",1985,futuristic
"Uglies (Uglies, #1)",Scott Westerfeld,3.84,"705,035",2005,futuristic
Fahrenheit 451 (Kindle Edition),Ray Bradbury,3.97,"2,777,566",1953,futuristic
Brave New World (Paperback),Aldous Huxley,3.99,"2,048,457",1932,futuristic
"Winter (The Lunar Chronicles, #4)",Marissa Meyer,4.41,"308,033",2015,futuristic
The Handmaid's Tale: The Seminal Work of Dystopian Feminist Fiction (Hardcover),Margaret Atwood,4.15,"2,374,513",1985,futuristic
"Ceremony in Death (In Death, #5)",J.D. Robb,4.27,"48,523",1997,futuristic
"Vengeance in Death (In Death, #6)",J.D. Robb,4.36,"46,519",1997,futuristic
"Conspiracy in Death (In Death, #8)",J.D. Robb,4.37,"42,540",1999,futuristic
"Holiday in Death (In Death, #7)",J.D. Robb,4.34,"45,098",1998,futuristic
"The Selection (The Selection, #1)",Kiera Cass,4.07,"1,739,878",2012,futuristic
"Judgment in Death (In Death, #11)",J.D. Robb,4.37,"40,617",2000,futuristic
"Betrayal in Death (In Death, #12)",J.D. Robb,4.35,"35,973",2001,futuristic
"Loyalty in Death (In Death, #9)",J.D. Robb,4.33,"37,594",1999,futuristic
"Legend (Legend, #1)",Marie Lu,4.15,"560,281",2011,futuristic
"The Host (The Host, #1)",Stephenie Meyer,3.86,"1,044,851",2008,futuristic
"Reunion in Death (In Death, #14)",J.D. Robb,4.38,"31,849",2002,futuristic
"Portrait in Death (In Death, #16)",J.D. Robb,4.39,"41,631",2003,futuristic
"Witness in Death (In Death, #10)",J.D. Robb,4.33,"37,130",2000,futuristic
"Purity in Death (In Death, #15)",J.D. Robb,4.38,"32,429",2002,futuristic
"Seduction in Death (In Death, #13)",J.D. Robb,4.35,"32,971",2001,futuristic
"Innocent in Death (In Death, #24)",J.D. Robb,4.40,"33,967",2007,futuristic
"Imitation in Death (In Death, #17)",J.D. Robb,4.39,"32,203",2003,futuristic
"Creation in Death (In Death, #25)",J.D. Robb,4.40,"29,736",2007,futuristic
"Survivor In Death (In Death, #20)",J.D. Robb,4.42,"35,026",2005,futuristic
"Visions in Death (In Death, #19)",J.D. Robb,4.39,"30,704",2004,futuristic
"Treachery in Death (In Death, #32)",J.D. Robb,4.47,"32,953",2011,futuristic
"Memory in Death (In Death, #22)",J.D. Robb,4.34,"33,367",2006,futuristic
"Promises in Death (In Death, #28)",J.D. Robb,4.42,"39,106",2009,futuristic
"Origin in Death (In Death, #21)",J.D. Robb,4.39,"31,308",2005,futuristic
"Divided in Death (In Death, #18)",J.D. Robb,4.36,"32,002",2004,futuristic
"New York to Dallas (In Death, #33)",J.D. Robb,4.45,"34,378",2011,futuristic
,,,,,futuristic
,,,,,futuristic
"The Deal (Off-Campus, #1)",Elle Kennedy,4.21,"1,002,584",2015,hockey-romance
"Icebreaker (UCMH, #1)",Hannah  Grace,3.75,"1,241,531",2022,hockey-romance
"The Mistake (Off-Campus, #2)",Elle Kennedy,3.97,"553,707",2015,hockey-romance
"The Score (Off-Campus, #3)",Elle Kennedy,4.15,"485,729",2016,hockey-romance
"Consider Me (Playing For Keeps, #1)",Becka Mack,3.85,"213,532",2022,hockey-romance
"Mile High (Windy City, #1)",Liz Tomforde,4.03,"491,639",2022,hockey-romance
"The Goal (Off-Campus, #4)",Elle Kennedy,3.87,"345,236",2016,hockey-romance
"Behind the Net (Vancouver Storm, #1)",Stephanie  Archer,3.80,"175,372",2023,hockey-romance
"Pucking Around (Jacksonville Rays, #1)",Emily Rath,3.75,"208,981",2023,hockey-romance
"The Chase (Briar U, #1)",Elle Kennedy,3.85,"261,729",2018,hockey-romance
"Offside (Rules of the Game, #1)",Avery Keelan,3.82,"95,368",2019,hockey-romance
"The Graham Effect (Campus Diaries, #1)",Elle Kennedy,4.18,"227,866",2023,hockey-romance
"The Risk (Briar U, #2)",Elle Kennedy,4.21,"213,337",2019,hockey-romance
"The Fake Out (Vancouver Storm, #2)",Stephanie  Archer,4.13,"130,319",2023,hockey-romance
"Play with Me (Playing for Keeps, #2)",Becka Mack,4.17,"126,491",2022,hockey-romance
"Collide (Off the Ice, #1)",Bal Khabra,3.76,"135,950",2023,hockey-romance
"The Legacy (Off-Campus, #5)",Elle Kennedy,3.78,"201,515",2021,hockey-romance
"The Play (Briar U, #3)",Elle Kennedy,4.01,"157,280",2019,hockey-romance
"Unravel Me (Playing for Keeps, #3)",Becka Mack,4.23,"103,336",2023,hockey-romance
"The Pucking Wrong Number (Pucking Wrong, #1)",C.R. Jane,3.54,"88,496",2023,hockey-romance
"The Dare (Briar U, #4)",Elle Kennedy,3.74,"139,320",2020,hockey-romance
"Unsteady (The Undone, #1)",Peyton Corinne,3.86,"72,514",2023,hockey-romance
"Breakaway (Beyond the Play, #2)",Grace Reilly,3.77,"64,287",2022,hockey-romance
"Wildfire (Maple Hills, #2)",Hannah  Grace,3.81,"455,057",2023,hockey-romance
"The Dixon Rule (Campus Diaries, #2)",Elle Kennedy,4.15,"133,337",2024,hockey-romance
"Right Man, Right Time (The Vancouver Agitators, #3)",Meghan Quinn,4.10,"98,135",2023,hockey-romance
"Powerless (Chestnut Springs, #3)",Elsie Silver,4.04,"419,772",2023,hockey-romance
"Shutout (Rules of the Game, #2)",Avery Keelan,4.00,"49,384",2023,hockey-romance
"Pucked (Pucked, #1)",Helena Hunting,3.85,"88,711",2015,hockey-romance
"Face Off (D.C. Stars, #1)",Chelsea Curto,4.06,"77,225",2024,hockey-romance
"Puck Me Secretly (Vancouver Wolves Hockey, #1)",Odette Stone,3.93,"48,773",2018,hockey-romance
"The Wingman (Vancouver Storm, #3)",Stephanie  Archer,3.93,"64,665",2024,hockey-romance
"Kiss and Don't Tell (The Vancouver Agitators, #1)",Meghan Quinn,4.00,"85,661",2021,hockey-romance
Weak Side (Bexley U),S.J. Sylvis,3.95,"37,908",2023,hockey-romance
"Rule Number Five (Rule Breaker, #1)",Jessa Wilder,3.79,"45,884",2023,hockey-romance
"Daydream (Maple Hills, #3)",Hannah  Grace,3.91,"223,693",2024,hockey-romance
The Enforcer (Lakeside University #1),Avery Keelan,3.79,"31,628",2022,hockey-romance
"Gloves Off (Vancouver Storm, #4)",Stephanie  Archer,4.27,"47,685",2025,hockey-romance
"That One Night (Jacksonville Rays, #0.5)",Emily Rath,4.07,"102,982",2023,hockey-romance
"Fall with Me (Playing for Keeps, #4)",Becka Mack,4.29,"70,687",2024,hockey-romance
"Lucky Hit (Swift Hat-Trick Trilogy, #1)",Hannah Cowan,3.60,"25,257",2021,hockey-romance
Brutal Obsession (Kindle Edition),S. Massery,3.82,"47,253",2022,hockey-romance
"Those Three Little Words (The Vancouver Agitators, #2)",Meghan Quinn,4.04,"75,210",2022,hockey-romance
"Until I Get You (Fairview Hockey, #1)",Claire Contreras,3.98,"61,271",2018,hockey-romance
"Pucking Wild (Jacksonville Rays, #2)",Emily Rath,4.12,"67,656",2023,hockey-romance
"Iced Out (Heston U Hotshots, #1)",Veronica Eden,3.88,"23,402",2023,hockey-romance
"He's Not My Type (The Vancouver Agitators, #4)",Meghan Quinn,4.26,"78,312",2023,hockey-romance
Him (Him #1),Sarina Bowen,4.21,"90,391",2015,hockey-romance
"Rewind It Back (Windy City, #5)",Liz Tomforde,4.47,"197,744",2025,hockey-romance
"Meet Your Match (Kings of the Ice, #1)",Kandi Steiner,3.94,"26,432",2023,hockey-romance
,,,,,hockey-romance
,,,,,hockey-romance
"Rivers of London (Rivers of London, #1)",Ben Aaronovitch,3.85,"146,665",2011,london
"Neverwhere (London Below, #1)",Neil Gaiman,4.16,"559,008",1996,london
London: The Biography (Paperback),Peter Ackroyd,3.96,"5,956",2000,london
Mrs. Dalloway (Hardcover),Virginia Woolf,3.78,"350,079",1925,london
"Moon Over Soho (Rivers of London, #2)",Ben Aaronovitch,4.08,"72,782",2011,london
"Whispers Under Ground (Rivers of London, #3)",Ben Aaronovitch,4.15,"63,632",2012,london
"The Cuckoo's Calling (Cormoran Strike, #1)",Robert Galbraith,3.89,"620,586",2013,london
Down and Out in Paris and London (Paperback),George Orwell,4.09,"99,551",1933,london
White Teeth (Paperback),Zadie Smith,3.79,"173,175",2000,london
"Broken Homes (Rivers of London, #4)",Ben Aaronovitch,4.16,"54,317",2013,london
The Girl on the Train (Hardcover),Paula Hawkins,3.96,"3,247,127",2015,london
"A Darker Shade of Magic (Shades of Magic, #1)",V.E. Schwab,4.04,"424,415",2015,london
NW (Hardcover),Zadie Smith,3.48,"44,981",2012,london
A Christmas Carol (Paperback),Charles Dickens,4.09,"905,614",1843,london
"84, Charing Cross Road (Paperback)",Helene Hanff,4.16,"95,389",1970,london
A Tale of Two Cities (Paperback),Charles Dickens,3.88,"1,004,785",1859,london
"The Silkworm (Cormoran Strike, #2)",Robert Galbraith,4.05,"291,088",2014,london
London (Kindle Edition),Edward Rutherfurd,4.09,"33,989",1997,london
"Londoners: The Days and Nights of London Now - As Told by Those Who Love It, Hate It, Live It, Left It, and Long for It (Hardcover)",Craig Taylor,3.89,"5,257",2011,london
1984 (Paperback),George Orwell,4.20,"5,346,448",1949,london
Oliver Twist (Paperback),Charles Dickens,3.88,"423,980",1838,london
The Picture of Dorian Gray (Paperback),Oscar Wilde,4.13,"1,832,966",1890,london
"The Ghost Map: The Story of London's Most Terrifying Epidemic—and How It Changed Science, Cities, and the Modern World (Hardcover)",Steven Johnson,3.89,"55,774",2006,london
"The Hanging Tree (Rivers of London, #6)",Ben Aaronovitch,4.22,"39,773",2016,london
London Under: The Secret History Beneath the Streets (Hardcover),Peter Ackroyd,3.46,"3,319",2011,london
"Career of Evil (Cormoran Strike, #3)",Robert Galbraith,4.22,"226,648",2015,london
Brick Lane (Paperback),Monica Ali,3.46,"35,525",2003,london
"Lethal White (Cormoran Strike, #4)",Robert Galbraith,4.25,"183,699",2018,london
"Girl, Woman, Other (Kindle Edition)",Bernardine Evaristo,4.26,"261,290",2019,london
Her Fearful Symmetry (Hardcover),Audrey Niffenegger,3.27,"95,915",2009,london
Great Expectations (Paperback),Charles Dickens,3.80,"865,984",1861,london
"Bridget Jones’s Diary (Bridget Jones, #1)",Helen Fielding,3.81,"1,018,210",1996,london
The Lonely Londoners (Paperback),Sam Selvon,3.70,"13,487",1956,london
The Lost Apothecary (Hardcover),Sarah Penner,3.76,"485,881",2021,london
Bleak House (Paperback),Charles Dickens,4.02,"113,291",1853,london
"Lies Sleeping (Rivers of London, #7)",Ben Aaronovitch,4.24,"31,784",2018,london
Dr. Jekyll and Mr. Hyde (Mass Market Paperback),Robert Louis Stevenson,3.83,"654,414",1886,london
"A Study in Scarlet (Sherlock Holmes, #1)",Arthur Conan Doyle,4.13,"488,792",1887,london
Queenie (Hardcover),Candice Carty-Williams,3.85,"156,072",2019,london
"Life After Life (Todd Family, #1)",Kate Atkinson,3.78,"239,849",2013,london
Fingersmith (ebook),Sarah Waters,4.02,"117,157",2002,london
The Five: The Untold Lives of the Women Killed by Jack the Ripper (Hardcover),Hallie Rubenhold,4.09,"65,889",2019,london
The Silent Patient (Hardcover),Alex Michaelides,4.17,"3,129,761",2019,london
"The Adventures of Sherlock Holmes (Sherlock Holmes, #3)",Arthur Conan Doyle,4.30,"323,446",1892,london
"The Midwife: A Memoir of Birth, Joy, and Hard Times (Paperback)",Jennifer Worth,4.19,"78,312",2002,london
"The Furthest Station (Rivers of London, #5.5)",Ben Aaronovitch,4.10,"21,125",2017,london
Jonathan Strange & Mr Norrell (Paperback),Susanna Clarke,3.87,"252,821",2004,london
Swing Time (Hardcover),Zadie Smith,3.56,"76,853",2016,london
"The Name of the Star (Shades of London, #1)",Maureen Johnson,3.89,"53,625",2011,london
"Wolf Hall (Thomas Cromwell, #1)",Hilary Mantel,3.91,"230,732",2009,london
,,,,,london
,,,,,london
Watchmen (Paperback),Alan             Moore,4.39,"591,383",1987,sequential-art
"Saga, Volume 1 (Paperback)",Brian K. Vaughan,,,,sequential-art
"The Sandman, Vol. 1: Preludes & Nocturnes (Hardcover)",Neil Gaiman,4.25,"272,862",1988,sequential-art
V for Vendetta (Hardcover),Alan             Moore,4.26,"323,051",1990,sequential-art
Fun Home: A Family Tragicomic (Paperback),Alison Bechdel,4.07,"199,947",2006,sequential-art
The Complete Maus (Paperback),Art Spiegelman,4.58,"250,139",1980,sequential-art
Nimona (ebook),N.D. Stevenson,4.18,"184,718",2015,sequential-art
"Saga, Volume 2 (Paperback)",Brian K. Vaughan,,,,sequential-art
Blankets (Paperback),Craig Thompson,4.06,"124,579",2003,sequential-art
"Saga, Volume 3 (Paperback)",Brian K. Vaughan,,,,sequential-art
"Heartstopper: Volume One (Heartstopper, #1)",Alice Oseman,4.42,"869,504",2018,sequential-art
The Complete Persepolis (Paperback),Marjane Satrapi,4.40,"202,791",2007,sequential-art
"Saga, Volume 4 (Paperback)",Brian K. Vaughan,,,,sequential-art
"The Sandman, Vol. 2: The Doll's House (Hardcover)",Neil Gaiman,4.43,"110,103",1990,sequential-art
"Persepolis: The Story of a Childhood (Persepolis, #1)",Marjane Satrapi,4.27,"227,879",2003,sequential-art
"Saga, Volume 5 (Paperback)",Brian K. Vaughan,,,,sequential-art
Through the Woods (Hardcover),E.M. Carroll,3.94,"87,303",2014,sequential-art
"Paper Girls, Volume 1 (Paperback)",Brian K. Vaughan,,,,sequential-art
Anya's Ghost (Hardcover),Vera Brosgol,3.90,"93,243",2011,sequential-art
"Maus I: A Survivor's Tale: My Father Bleeds History (Maus, #1)",Art Spiegelman,4.39,"370,638",1986,sequential-art
Welcome to Lovecraft (Locke & Key #1),Joe Hill,4.15,"99,485",2008,sequential-art
"Heartstopper: Volume Two (Heartstopper, #2)",Alice Oseman,4.51,"562,844",2019,sequential-art
"Adulthood Is a Myth (Sarah's Scribbles, #1)",Sarah Andersen,4.12,"129,813",2016,sequential-art
"The Wicked + The Divine, Vol. 1: The Faust Act (Paperback)",Kieron Gillen,,,,sequential-art
Batman: The Killing Joke (Paperback),Alan             Moore,4.36,"239,240",1988,sequential-art
Understanding Comics: The Invisible Art (Paperback),Scott McCloud,4.00,"130,636",1993,sequential-art
The Prince and the Dressmaker (Paperback),Jen Wang,4.33,"121,079",2018,sequential-art
"Saga, Volume 6 (Paperback)",Brian K. Vaughan,,,,sequential-art
"Fables, Vol. 1: Legends in Exile (Paperback)",Bill Willingham,,,,sequential-art
"Scott Pilgrim's Precious Little Life (Scott Pilgrim, #1)",Bryan Lee O'Malley,,,,sequential-art
"The Sandman, Vol. 3: Dream Country (Hardcover)",Neil Gaiman,4.24,"124,387",1990,sequential-art
Ghost World (Paperback),Daniel Clowes,3.82,"79,189",1998,sequential-art
The Arrival (Hardcover),Shaun Tan,4.35,"59,565",2007,sequential-art
"Ms. Marvel, Vol. 1: No Normal (Paperback)",G. Willow Wilson,4.10,"92,323",2014,sequential-art
"Heartstopper: Volume Three (Heartstopper, #3)",Alice Oseman,4.54,"493,224",2020,sequential-art
"The Sandman, Vol. 4: Season of Mists (Hardcover)",Neil Gaiman,4.53,"80,625",1991,sequential-art
This One Summer (Hardcover),Mariko Tamaki,3.69,"91,826",2014,sequential-art
Batman: Year One (Paperback),Frank Miller,,,,sequential-art
"Saga, Volume 7 (Paperback)",Brian K. Vaughan,,,,sequential-art
"Maus II: A Survivor's Tale: And Here My Troubles Began (Maus, #2)",Art Spiegelman,4.43,"157,239",1991,sequential-art
"Y: The Last Man, Vol. 1: Unmanned (Paperback)",Brian K. Vaughan,4.08,"118,717",2003,sequential-art
American Born Chinese (Paperback),Gene Luen Yang,3.88,"100,926",2006,sequential-art
"Death Note, Vol. 1: Boredom (Death Note, #1)",Tsugumi Ohba,4.47,"353,805",2004,sequential-art
"The Sandman, Vol. 5: A Game of You (Hardcover)",Neil Gaiman,4.41,"68,623",1992,sequential-art
Daytripper (Paperback),Fábio Moon,4.33,"36,912",2011,sequential-art
Black Hole (Hardcover),Charles Burns,3.85,"52,587",2005,sequential-art
"Scott Pilgrim vs. The World (Scott Pilgrim, #2)",Bryan Lee O'Malley,,,,sequential-art
